04:46:10.318410 IP 68.183.198.137.22 > 174.91.92.110.58929: Flags [P.], seq 2470544:2471020, ack 1441, win 501, length 476
04:46:10.318543 IP 68.183.198.137.22 > 174.91.92.110.58929: Flags [P.], seq 2471020:2471184, ack 1441, win 501, length 164
04:46:10.318670 IP 68.183.198.137.22 > 174.91.92.110.58929: Flags [P.], seq 2471184:2471348, ack 1441, win 501, length 164
04:46:10.318800 IP 68.183.198.137.22 > 174.91.92.110.58929: Flags [P.], seq 2471348:2471512, ack 1441, win 501, length 164
04:46:10.318954 IP 68.183.198.137.22 > 174.91.92.110.58929: Flags [P.], seq 2471512:2471676, ack 1441, win 501, length 164
04:46:10.319090 IP 68.183.198.137.22 > 174.91.92.110.58929: Flags [P.], seq 2471676:2471840, ack 1441, win 501, length 164
04:46:10.319215 IP 174.91.92.110.58929 > 68.183.198.137.22: Flags [.], ack 2464972, win 1023, length 0
04:46:10.319215 IP 174.91.92.110.58929 > 68.183.198.137.22: Flags [.], ack 2465776, win 1026, length 0
04:46:10.319215 IP 174.91.92.110.58929 > 68.183.198.137.22: Flags [.], ack 2465940, win 1025, length 0
04:46:10.319370 IP 68.183.198.137.22 > 174.91.92.110.58929: Flags [P.], seq 2471840:2472316, ack 1441, win 501, length 476
04:46:10.319516 IP 68.183.198.137.22 > 174.91.92.110.58929: Flags [P.], seq 2472316:2472480, ack 1441, win 501, length 164
04:46:10.319648 IP 68.183.198.137.22 > 174.91.92.110.58929: Flags [P.], seq 2472480:2472644, ack 1441, win 501, length 164
04:46:10.319776 IP 68.183.198.137.22 > 174.91.92.110.58929: Flags [P.], seq 2472644:2472808, ack 1441, win 501, length 164
04:46:10.319907 IP 68.183.198.137.22 > 174.91.92.110.58929: Flags [P.], seq 2472808:2472972, ack 1441, win 501, length 164
04:46:10.320068 IP 68.183.198.137.22 > 174.91.92.110.58929: Flags [P.], seq 2472972:2473136, ack 1441, win 501, length 164
04:46:10.320254 IP 174.91.92.110.58929 > 68.183.198.137.22: Flags [.], ack 2466432, win 1024, length 0
04:46:10.320254 IP 174.91.92.110.58929 > 68.183.198.137.22: Flags [.], ack 2466596, win 1023, length 0
04:46:10.320254 IP 174.91.92.110.58929 > 68.183.198.137.22: Flags [.], ack 2467132, win 1021, length 0
04:46:10.320255 IP 174.91.92.110.58929 > 68.183.198.137.22: Flags [.], ack 2467460, win 1026, length 0
04:46:10.320284 IP 68.183.198.137.22 > 174.91.92.110.58929: Flags [P.], seq 2473136:2473300, ack 1441, win 501, length 164
04:46:10.320494 IP 68.183.198.137.22 > 174.91.92.110.58929: Flags [P.], seq 2473300:2473880, ack 1441, win 501, length 580
04:46:10.320635 IP 68.183.198.137.22 > 174.91.92.110.58929: Flags [P.], seq 2473880:2474044, ack 1441, win 501, length 164
04:46:10.320768 IP 68.183.198.137.22 > 174.91.92.110.58929: Flags [P.], seq 2474044:2474208, ack 1441, win 501, length 164
04:46:10.320897 IP 68.183.198.137.22 > 174.91.92.110.58929: Flags [P.], seq 2474208:2474372, ack 1441, win 501, length 164
04:46:10.321030 IP 68.183.198.137.22 > 174.91.92.110.58929: Flags [P.], seq 2474372:2474536, ack 1441, win 501, length 164
04:46:10.321165 IP 68.183.198.137.22 > 174.91.92.110.58929: Flags [P.], seq 2474536:2474700, ack 1441, win 501, length 164
04:46:10.321231 IP 174.91.92.110.58929 > 68.183.198.137.22: Flags [.], ack 2467788, win 1025, length 0
04:46:10.321231 IP 174.91.92.110.58929 > 68.183.198.137.22: Flags [.], ack 2468592, win 1022, length 0
04:46:10.321231 IP 174.91.92.110.58929 > 68.183.198.137.22: Flags [.], ack 2468756, win 1021, length 0
04:46:10.321408 IP 68.183.198.137.22 > 174.91.92.110.58929: Flags [P.], seq 2474700:2475176, ack 1441, win 501, length 476
04:46:10.321550 IP 68.183.198.137.22 > 174.91.92.110.58929: Flags [P.], seq 2475176:2475340, ack 1441, win 501, length 164
04:46:10.321688 IP 68.183.198.137.22 > 174.91.92.110.58929: Flags [P.], seq 2475340:2475504, ack 1441, win 501, length 164
04:46:10.321826 IP 68.183.198.137.22 > 174.91.92.110.58929: Flags [P.], seq 2475504:2475668, ack 1441, win 501, length 164
04:46:10.321954 IP 68.183.198.137.22 > 174.91.92.110.58929: Flags [P.], seq 2475668:2475832, ack 1441, win 501, length 164
04:46:10.322093 IP 68.183.198.137.22 > 174.91.92.110.58929: Flags [P.], seq 2475832:2475996, ack 1441, win 501, length 164
04:46:10.322219 IP 174.91.92.110.58929 > 68.183.198.137.22: Flags [.], ack 2469084, win 1026, length 0
04:46:10.322219 IP 174.91.92.110.58929 > 68.183.198.137.22: Flags [.], ack 2469888, win 1023, length 0
04:46:10.322219 IP 174.91.92.110.58929 > 68.183.198.137.22: Flags [.], ack 2470052, win 1022, length 0
04:46:10.322340 IP 174.91.92.110.58929 > 68.183.198.137.22: Flags [.], ack 2470380, win 1021, length 0
04:46:10.322447 IP 68.183.198.137.22 > 174.91.92.110.58929: Flags [P.], seq 2475996:2476576, ack 1441, win 501, length 580
04:46:10.322587 IP 68.183.198.137.22 > 174.91.92.110.58929: Flags [P.], seq 2476576:2476740, ack 1441, win 501, length 164
04:46:10.322724 IP 68.183.198.137.22 > 174.91.92.110.58929: Flags [P.], seq 2476740:2476904, ack 1441, win 501, length 164
04:46:10.322883 IP 68.183.198.137.22 > 174.91.92.110.58929: Flags [P.], seq 2476904:2477068, ack 1441, win 501, length 164
04:46:10.323023 IP 68.183.198.137.22 > 174.91.92.110.58929: Flags [P.], seq 2477068:2477232, ack 1441, win 501, length 164
04:46:10.323155 IP 68.183.198.137.22 > 174.91.92.110.58929: Flags [P.], seq 2477232:2477396, ack 1441, win 501, length 164
04:46:10.323221 IP 174.91.92.110.58929 > 68.183.198.137.22: Flags [.], ack 2471020, win 1026, length 0
04:46:10.323221 IP 174.91.92.110.58929 > 68.183.198.137.22: Flags [.], ack 2471348, win 1025, length 0
04:46:10.323324 IP 174.91.92.110.58929 > 68.183.198.137.22: Flags [.], ack 2471676, win 1024, length 0
04:46:10.323429 IP 68.183.198.137.22 > 174.91.92.110.58929: Flags [P.], seq 2477396:2477872, ack 1441, win 501, length 476
04:46:10.323573 IP 68.183.198.137.22 > 174.91.92.110.58929: Flags [P.], seq 2477872:2478036, ack 1441, win 501, length 164
04:46:10.323702 IP 68.183.198.137.22 > 174.91.92.110.58929: Flags [P.], seq 2478036:2478200, ack 1441, win 501, length 164
04:46:10.323824 IP 68.183.198.137.22 > 174.91.92.110.58929: Flags [P.], seq 2478200:2478364, ack 1441, win 501, length 164
04:46:10.323966 IP 68.183.198.137.22 > 174.91.92.110.58929: Flags [P.], seq 2478364:2478528, ack 1441, win 501, length 164
04:46:10.324058 IP 68.183.198.137.22 > 174.91.92.110.58929: Flags [P.], seq 2478528:2478692, ack 1441, win 501, length 164
04:46:10.324142 IP 68.183.198.137.22 > 174.91.92.110.58929: Flags [P.], seq 2478692:2478856, ack 1441, win 501, length 164
04:46:10.324212 IP 174.91.92.110.58929 > 68.183.198.137.22: Flags [.], ack 2472316, win 1021, length 0
04:46:10.324213 IP 174.91.92.110.58929 > 68.183.198.137.22: Flags [.], ack 2472644, win 1026, length 0
04:46:10.324257 IP 68.183.198.137.22 > 174.91.92.110.58929: Flags [P.], seq 2478856:2479020, ack 1441, win 501, length 164
04:46:10.324375 IP 68.183.198.137.22 > 174.91.92.110.58929: Flags [P.], seq 2479020:2479392, ack 1441, win 501, length 372
04:46:10.324460 IP 68.183.198.137.22 > 174.91.92.110.58929: Flags [P.], seq 2479392:2479556, ack 1441, win 501, length 164
04:46:10.324540 IP 68.183.198.137.22 > 174.91.92.110.58929: Flags [P.], seq 2479556:2479720, ack 1441, win 501, length 164
04:46:10.324619 IP 68.183.198.137.22 > 174.91.92.110.58929: Flags [P.], seq 2479720:2479884, ack 1441, win 501, length 164
04:46:10.324698 IP 68.183.198.137.22 > 174.91.92.110.58929: Flags [P.], seq 2479884:2480048, ack 1441, win 501, length 164
04:46:10.324781 IP 68.183.198.137.22 > 174.91.92.110.58929: Flags [P.], seq 2480048:2480212, ack 1441, win 501, length 164
04:46:10.324862 IP 68.183.198.137.22 > 174.91.92.110.58929: Flags [P.], seq 2480212:2480376, ack 1441, win 501, length 164
04:46:10.324942 IP 68.183.198.137.22 > 174.91.92.110.58929: Flags [P.], seq 2480376:2480540, ack 1441, win 501, length 164
04:46:10.325019 IP 68.183.198.137.22 > 174.91.92.110.58929: Flags [P.], seq 2480540:2480704, ack 1441, win 501, length 164
04:46:10.325103 IP 68.183.198.137.22 > 174.91.92.110.58929: Flags [P.], seq 2480704:2480868, ack 1441, win 501, length 164
04:46:10.325185 IP 68.183.198.137.22 > 174.91.92.110.58929: Flags [P.], seq 2480868:2481032, ack 1441, win 501, length 164
04:46:10.325207 IP 174.91.92.110.58929 > 68.183.198.137.22: Flags [.], ack 2472972, win 1025, length 0
04:46:10.325269 IP 174.91.92.110.58929 > 68.183.198.137.22: Flags [.], ack 2473300, win 1024, length 0
04:46:10.325269 IP 174.91.92.110.58929 > 68.183.198.137.22: Flags [P.], seq 1441:1477, ack 2473300, win 1024, length 36
04:46:10.325286 IP 174.91.92.110.58929 > 68.183.198.137.22: Flags [.], ack 2474044, win 1021, length 0
04:46:10.325286 IP 174.91.92.110.58929 > 68.183.198.137.22: Flags [.], ack 2474372, win 1026, length 0
^C
17049 packets captured
17049 packets received by filter
0 packets dropped by kernel
